id,pardon_date,minister,crime,gender
BOE-A-1999-20282,1999-09-24,Margarita Mariscal De Gante,"un delito de atentado a agentes de la autoridad, a la pena de once meses de prisión menor y de una falta de lesiones, a la pena de cuatro días de arresto menor, con las accesorias de suspensión de todo cargo público y derecho de sufragio durante el tiempo de la condena",Hombre
BOE-A-2002-17841,2002-08-30,Jose María Michavila,"un delito de contrabando, a la pena de dos meses y un día de arresto mayor y multa de 1.050.000 pesetas, y un delito contra la salud pública, a la pena de seis meses de arresto mayor y multa de 500.000 pesetas, con las accesorias legales",Hombre
BOE-A-2003-2272,2003-01-17,Jose María Michavila,"un delito de tráfico de drogas, a la pena de tres años y nueve meses de prisión y multa de 160.000.000 de pesetas, con las accesorias de inhabilitación especial para el derecho de sufragio pasivo durante el tiempo de la condena",Hombre
BOE-A-2007-6976,2007-03-16,Mariano Fernández,"un delito contra la salud pública, a la pena de tres años y un día de prisión y multa de 18.000 euros, con las accesorias legales",Hombre
BOE-A-2011-989,2010-12-23,Francisco Camaño,"un delito continuado de estafa, a la pena de veintiún meses de prisión y nueve meses de multa con una cuota diaria de tres euros; un delito continuado de falsedad en documento mercantil, a la pena de vientiún meses de prisión y nueve meses de multa con una cuota diaria de tres euros, con las accesorias de inhabilitación especial para el derecho de sufragio pasivo durante el tiempo de la condena, y una falta de apropiación indebida, a la pena de un mes de multa con una cuota diaria de tres euros",Hombre
BOE-A-2011-10811,2011-05-27,Francisco Camaño,"un delito contra la salud pública, a la pena de tres años y un día de prisión, con la accesoria de inhabilitación especial para el ejercicio al derecho del sufragio pasivo durante el tiempo de la condena y multa de 8.500 euros",Mujer
